[
  {
    "id": "CSPTF-CTRL-GOV-001",
    "domain_id": "CSPTF-DOM-01",
    "domain_code": "GOV",
    "title_es": "Gobierno y responsabilidad del programa",
    "title_en": "",
    "objective": "Asegurar que gobierno y responsabilidad del programa se diseñe, implemente, opere y evidencie de forma proporcional al riesgo del ecosistema de activos digitales.",
    "requirement": "La organización DEBE definir, aprobar, implementar, monitorear y revisar gobierno y responsabilidad del programa, manteniendo evidencia trazable y excepciones formalmente aceptadas.",
    "minimum_profile": "AP1",
    "evidence": "Política o diseño aprobado; configuración o artefacto técnico; registro operativo; evidencia de revisión; prueba de eficacia relacionada con gobierno y responsabilidad del programa.",
    "owner_examples": "Seguridad; Ingeniería; Operaciones; Riesgo; Cumplimiento, según el control.",
    "aadapt_tactics": "Reconnaissance; Resource Development; Initial Access; Impact; Fraud",
    "nist_csf2": "GV; ID",
    "owasp_alignment": "SCSTG engagement planning; SCSVS governance context",
    "status": "draft"
  },
  {
    "id": "CSPTF-CTRL-GOV-002",
    "domain_id": "CSPTF-DOM-01",
    "domain_code": "GOV",
    "title_es": "Inventario y clasificación de activos digitales",
    "title_en": "",
    "objective": "Asegurar que inventario y clasificación de activos digitales se diseñe, implemente, opere y evidencie de forma proporcional al riesgo del ecosistema de activos digitales.",
    "requirement": "La organización DEBE definir, aprobar, implementar, monitorear y revisar inventario y clasificación de activos digitales, manteniendo evidencia trazable y excepciones formalmente aceptadas.",
    "minimum_profile": "AP1",
    "evidence": "Política o diseño aprobado; configuración o artefacto técnico; registro operativo; evidencia de revisión; prueba de eficacia relacionada con inventario y clasificación de activos digitales.",
    "owner_examples": "Seguridad; Ingeniería; Operaciones; Riesgo; Cumplimiento, según el control.",
    "aadapt_tactics": "Reconnaissance; Resource Development; Initial Access; Impact; Fraud",
    "nist_csf2": "GV; ID",
    "owasp_alignment": "SCSTG engagement planning; SCSVS governance context",
    "status": "draft"
  },
  {
    "id": "CSPTF-CTRL-GOV-003",
    "domain_id": "CSPTF-DOM-01",
    "domain_code": "GOV",
    "title_es": "Reglas de compromiso y autorización",
    "title_en": "",
    "objective": "Asegurar que reglas de compromiso y autorización se diseñe, implemente, opere y evidencie de forma proporcional al riesgo del ecosistema de activos digitales.",
    "requirement": "La organización DEBE definir, aprobar, implementar, monitorear y revisar reglas de compromiso y autorización, manteniendo evidencia trazable y excepciones formalmente aceptadas.",
    "minimum_profile": "AP2",
    "evidence": "Política o diseño aprobado; configuración o artefacto técnico; registro operativo; evidencia de revisión; prueba de eficacia relacionada con reglas de compromiso y autorización.",
    "owner_examples": "Seguridad; Ingeniería; Operaciones; Riesgo; Cumplimiento, según el control.",
    "aadapt_tactics": "Reconnaissance; Resource Development; Initial Access; Impact; Fraud",
    "nist_csf2": "GV; ID",
    "owasp_alignment": "SCSTG engagement planning; SCSVS governance context",
    "status": "draft"
  },
  {
    "id": "CSPTF-CTRL-GOV-004",
    "domain_id": "CSPTF-DOM-01",
    "domain_code": "GOV",
    "title_es": "Modelado de amenazas orientado al negocio",
    "title_en": "",
    "objective": "Asegurar que modelado de amenazas orientado al negocio se diseñe, implemente, opere y evidencie de forma proporcional al riesgo del ecosistema de activos digitales.",
    "requirement": "La organización DEBE definir, aprobar, implementar, monitorear y revisar modelado de amenazas orientado al negocio, manteniendo evidencia trazable y excepciones formalmente aceptadas.",
    "minimum_profile": "AP2",
    "evidence": "Política o diseño aprobado; configuración o artefacto técnico; registro operativo; evidencia de revisión; prueba de eficacia relacionada con modelado de amenazas orientado al negocio.",
    "owner_examples": "Seguridad; Ingeniería; Operaciones; Riesgo; Cumplimiento, según el control.",
    "aadapt_tactics": "Reconnaissance; Resource Development; Initial Access; Impact; Fraud",
    "nist_csf2": "GV; ID",
    "owasp_alignment": "SCSTG engagement planning; SCSVS governance context",
    "status": "draft"
  },
  {
    "id": "CSPTF-CTRL-GOV-005",
    "domain_id": "CSPTF-DOM-01",
    "domain_code": "GOV",
    "title_es": "Gestión de terceros y dependencias críticas",
    "title_en": "",
    "objective": "Asegurar que gestión de terceros y dependencias críticas se diseñe, implemente, opere y evidencie de forma proporcional al riesgo del ecosistema de activos digitales.",
    "requirement": "La organización DEBE definir, aprobar, implementar, monitorear y revisar gestión de terceros y dependencias críticas, manteniendo evidencia trazable y excepciones formalmente aceptadas.",
    "minimum_profile": "AP2",
    "evidence": "Política o diseño aprobado; configuración o artefacto técnico; registro operativo; evidencia de revisión; prueba de eficacia relacionada con gestión de terceros y dependencias críticas.",
    "owner_examples": "Seguridad; Ingeniería; Operaciones; Riesgo; Cumplimiento, según el control.",
    "aadapt_tactics": "Reconnaissance; Resource Development; Initial Access; Impact; Fraud",
    "nist_csf2": "GV; ID",
    "owasp_alignment": "SCSTG engagement planning; SCSVS governance context",
    "status": "draft"
  },
  {
    "id": "CSPTF-CTRL-GOV-006",
    "domain_id": "CSPTF-DOM-01",
    "domain_code": "GOV",
    "title_es": "Presupuestos de riesgo, pérdida y transacción",
    "title_en": "",
    "objective": "Asegurar que presupuestos de riesgo, pérdida y transacción se diseñe, implemente, opere y evidencie de forma proporcional al riesgo del ecosistema de activos digitales.",
    "requirement": "La organización DEBE definir, aprobar, implementar, monitorear y revisar presupuestos de riesgo, pérdida y transacción, manteniendo evidencia trazable y excepciones formalmente aceptadas.",
    "minimum_profile": "AP3",
    "evidence": "Política o diseño aprobado; configuración o artefacto técnico; registro operativo; evidencia de revisión; prueba de eficacia relacionada con presupuestos de riesgo, pérdida y transacción.",
    "owner_examples": "Seguridad; Ingeniería; Operaciones; Riesgo; Cumplimiento, según el control.",
    "aadapt_tactics": "Reconnaissance; Resource Development; Initial Access; Impact; Fraud",
    "nist_csf2": "GV; ID",
    "owasp_alignment": "SCSTG engagement planning; SCSVS governance context",
    "status": "draft"
  },
  {
    "id": "CSPTF-CTRL-GOV-007",
    "domain_id": "CSPTF-DOM-01",
    "domain_code": "GOV",
    "title_es": "Gestión de cambios durante la evaluación",
    "title_en": "",
    "objective": "Asegurar que gestión de cambios durante la evaluación se diseñe, implemente, opere y evidencie de forma proporcional al riesgo del ecosistema de activos digitales.",
    "requirement": "La organización DEBE definir, aprobar, implementar, monitorear y revisar gestión de cambios durante la evaluación, manteniendo evidencia trazable y excepciones formalmente aceptadas.",
    "minimum_profile": "AP3",
    "evidence": "Política o diseño aprobado; configuración o artefacto técnico; registro operativo; evidencia de revisión; prueba de eficacia relacionada con gestión de cambios durante la evaluación.",
    "owner_examples": "Seguridad; Ingeniería; Operaciones; Riesgo; Cumplimiento, según el control.",
    "aadapt_tactics": "Reconnaissance; Resource Development; Initial Access; Impact; Fraud",
    "nist_csf2": "GV; ID",
    "owasp_alignment": "SCSTG engagement planning; SCSVS governance context",
    "status": "draft"
  },
  {
    "id": "CSPTF-CTRL-GOV-008",
    "domain_id": "CSPTF-DOM-01",
    "domain_code": "GOV",
    "title_es": "Aceptación, excepción y cierre de hallazgos",
    "title_en": "",
    "objective": "Asegurar que aceptación, excepción y cierre de hallazgos se diseñe, implemente, opere y evidencie de forma proporcional al riesgo del ecosistema de activos digitales.",
    "requirement": "La organización DEBE definir, aprobar, implementar, monitorear y revisar aceptación, excepción y cierre de hallazgos, manteniendo evidencia trazable y excepciones formalmente aceptadas.",
    "minimum_profile": "AP4",
    "evidence": "Política o diseño aprobado; configuración o artefacto técnico; registro operativo; evidencia de revisión; prueba de eficacia relacionada con aceptación, excepción y cierre de hallazgos.",
    "owner_examples": "Seguridad; Ingeniería; Operaciones; Riesgo; Cumplimiento, según el control.",
    "aadapt_tactics": "Reconnaissance; Resource Development; Initial Access; Impact; Fraud",
    "nist_csf2": "GV; ID",
    "owasp_alignment": "SCSTG engagement planning; SCSVS governance context",
    "status": "draft"
  },
  {
    "id": "CSPTF-CTRL-ARC-001",
    "domain_id": "CSPTF-DOM-02",
    "domain_code": "ARC",
    "title_es": "Arquitectura documentada y versionada",
    "title_en": "",
    "objective": "Asegurar que arquitectura documentada y versionada se diseñe, implemente, opere y evidencie de forma proporcional al riesgo del ecosistema de activos digitales.",
    "requirement": "La organización DEBE definir, aprobar, implementar, monitorear y revisar arquitectura documentada y versionada, manteniendo evidencia trazable y excepciones formalmente aceptadas.",
    "minimum_profile": "AP1",
    "evidence": "Política o diseño aprobado; configuración o artefacto técnico; registro operativo; evidencia de revisión; prueba de eficacia relacionada con arquitectura documentada y versionada.",
    "owner_examples": "Seguridad; Ingeniería; Operaciones; Riesgo; Cumplimiento, según el control.",